{
  "schema": "workshop2-visual-handoff-v1",
  "exportedAt": "2026-04-01T12:00:00.000Z",
  "articleSku": "DEMO-SKU-01",
  "visualRouteGate": {
    "allClear": false,
    "openMessages": ["Нет визуальных референсов."]
  },
  "visualQuickSummary": {
    "checklistDone": 2,
    "checklistTotal": 7,
    "referenceCount": 0,
    "sketchPinTotal": 3,
    "sketchHasSubstrate": true,
    "intentOrNotesFilled": true,
    "canonicalPhotoAndSketchSet": false
  },
  "references": [],
  "masterPinCount": 2,
  "sheetPinCountTotal": 1
}
